"The point is, art never stopped a war and never got anybody a job. That was never its function. Art cannot change events. But it can change people. It can affect people so that they are changed... because people are changed by art – enriched, ennobled, encouraged – they then act in a way that may affect the course of events... by the way they vote, they behave, the way they think.",Leonard Bernstein,"activism, arts, inspiration, social-change",,,,,,,,,,,,,,,,,,,,,,,,,,,,,,,,,,,,,,,
"Oh, I`m sure Tristin will do it"" She said casually as she hung the dress back on the hanger. I stared at her in confusion. ""Surely he knows how to put a condom."" The visual made my insides squirm with panic. ""I mean the whole thing! All of it!"" I cried.""Oh"" She looked at me with surprise and then her expression dissolved into understanding. ""Honey, it will all come naturally.""""How do I know what natural is though? How do I know what`s right? What if I do it all wrong?""She smiled. ""The thing about men, Alexis, is they generally don`t find any of it wrong. In fact, usually the more wrong it is, the more they like it.","Kristie Cook, Promise","humor, sex",,,,,,,,,,,,,,,,,,,,,,,,,,,,,,,,,,,,,,,
"Pride costs us more than hunger, thirst, and cold.",Thomas Jefferson,"cost, jefferson, pride, thomas",,,,,,,,,,,,,,,,,,,,,,,,,,,,,,,,,,,,,,,
God will help you in a way you will not know he did. at’s his trick.,"Ben Tolosa, Masterplan Your Success","christianity, god, god-s-love",,,,,,,,,,,,,,,,,,,,,,,,,,,,,,,,,,,,,,,
"Live. Do whatever possible to stay alive. I'll be waiting. Praying, faithful. Just live. - Jo Marie Rose, Silver Linings",Debbie Macomber,"healing, romance",,,,,,,,,,,,,,,,,,,,,,,,,,,,,,,,,,,,,,,
"We are, on earth, two distinct races. Those who have need of others, whom others amuse, engage soothe, whom solitude harasses, pains, stupefies, like the movement of a terrible glacier or the traversing of the desert; and those, on the contrary, whom others weary, tire, bore, silently torture, whom isolation calms and bathes in the repose of independency, and plunges into the humors of their own thoughts. In fine, there is here a normal, physical phenomenon. Some are constituted to live a life outside of themselves, others, to live a life within themselves. As for me, my exterior associations are abruptly and painfully short-lived, and, as they reach their limits, I experience in my whole body and in my whole intelligence an intolerable uneasiness. ",Guy de Maupassant,"humanity, life",,,,,,,,,,,,,,,,,,,,,,,,,,,,,,,,,,,,,,,
"...no matter how avid they themselves may be for praise and appreciation, people are often niggardly in giving it to others, however merited it is.","Eleanor Roosevelt, You Learn by Living: Eleven Keys for a More Fulfilling Life","appreciation, eleanor-roosevelt, merit, praise",,,,,,,,,,,,,,,,,,,,,,,,,,,,,,,,,,,,,,,
Nothing takes the taste out of peanut butter quite like unrequited love.,Charles M. Schulz,"humor, love",,,,,,,,,,,,,,,,,,,,,,,,,,,,,,,,,,,,,,,
"People have been sleeping and/or marrying their way to the top since the first cavewoman said: ‘Ugh, that one’s the strongest and has the biggest club. I’ll shake my mastodon-skin-covered ass at him.’”“Ugh?”“Or whatever cave people said. And it’s not just women who do it. Cave guy goes: ‘Ugh, that one catches the most fish, I’ll be dragging her off to my cave now.’ Ava sees Tommy and—”“Says ugh.”“Or today’s equivalent thereof.”-Eve & Roarke. .","J.D. Robb, Strangers in Death","eve, hilarious, in-death, marriage, reality, roarke",,,,,,,,,,,,,,,,,,,,,,,,,,,,,,,,,,,,,,,
Impossibility is only a whisper away from reality,Steven Aitchison,"inspirational, motivational, reality, whisper",,,,,,,,,,,,,,,,,,,,,,,,,,,,,,,,,,,,,,,
There are some ideas so wrong that only a very intelligent person could believe in them.,George Orwell,"Believe, Ideas, Intelligent ",,,,,,,,,,,,,,,,,,,,,,,,,,,,,,,,,,,,,,,
"Arshan, The Lord of Hounds has been let out of his prison once, should the heroine, Salarn trust him now?",LJ Fuler,thought-provoking,,,,,,,,,,,,,,,,,,,,,,,,,,,,,,,,,,,,,,,
"As photographs give people an imaginary possession of a past that is unreal, they also help people to take possession of space in which they are insecure.",Susan Sontag,"Past, People, Help ",,,,,,,,,,,,,,,,,,,,,,,,,,,,,,,,,,,,,,,
Hard times ain't quit and we ain't quit.,Meridel Le Sueur,"pressure, , diamonds, ",,,,,,,,,,,,,,,,,,,,,,,,,,,,,,,,,,,,,,,
"The walls of hell are coated with arrogance, and the floor is covered with pride.",T.A. Cline,"arrogance, loneliness, pride, self",,,,,,,,,,,,,,,,,,,,,,,,,,,,,,,,,,,,,,,
"Do you have regrets that we were so overwhelmed? Do you ever wish to live those hours over again and differently, with more confidence.","Anaïs Nin, Henry and June: From ""A Journal of Love""--The Unexpurgated Diary of Anaïs Nin",regrets,,,,,,,,,,,,,,,,,,,,,,,,,,,,,,,,,,,,,,,
"Piper’s lust was like a single bear trap in the wilderness. It was nearly impossible to find if you were looking for it, but it was something you wanted to be prepared for if you stepped into it by accident.","Maggie Stiefvater, Blue Lily, Lily Blue","bear-trap, humor, husband, lust, wife-and-husband",,,,,,,,,,,,,,,,,,,,,,,,,,,,,,,,,,,,,,,
Creativity arises from our ability to see things from many different angles.,"Keri Smith, How to Be an Explorer of the World: Portable Life Museum",creativity,,,,,,,,,,,,,,,,,,,,,,,,,,,,,,,,,,,,,,,
It was her chaos that made her beautiful. ,"Atticus Poetry, Love Her Wild: Poems","atticus, atticus-poetry, atticuspoetry, her, instagram, love, love-her-wild, poems, poetry, quotes, wild",,,,,,,,,,,,,,,,,,,,,,,,,,,,,,,,,,,,,,,
"The customers perception is your reality. What they think about your products , MATTER. If you dont put your customers perception first, THE GAME IS OVER.",Sharfaraz Ahmed,"business-quotes, customer-satisfaction",,,,,,,,,,,,,,,,,,,,,,,,,,,,,,,,,,,,,,,
"Much that for us is fraught with with happiness or misery, remains almost unnoticed by the rest of the world.","Marcel Proust, Jean Santeuil","happiness, misery",,,,,,,,,,,,,,,,,,,,,,,,,,,,,,,,,,,,,,,
There are two kinds of science: The black science and the white science. The science of weapon production is the black one. Working in this category of science is a great betrayal to humanity!,Mehmet Murat ildan,science,,,,,,,,,,,,,,,,,,,,,,,,,,,,,,,,,,,,,,,
